<?xml version="1.0" encoding="UTF-8"?>
<pedidos xmlns:xsi="http://www.w3.org/2001/XMLSchema-instance" 
    xsi:noNamespaceSchemaLocation="pedidos.xsd">
    <sucursal codigo="A0000001">
        <direccion>Calle Ecuador NÂº7</direccion>
        <nombreTrabajador>Eustaquio Lara Lozano</nombreTrabajador>
        <fechaPedido>2023-02-10</fechaPedido>
        <observaciones>urgente</observaciones>
        <articulo codigo="AAA-001">
            <numUnidades>1</numUnidades>
            <precioUnidad>32</precioUnidad>
            <observaciones>Muy pesado</observaciones>
            <plazoRevision>15</plazoRevision>
        </articulo>
    </sucursal>
</pedidos>